,title,selftext,subreddit,author,created_utc,num_comments,is_self,timestamp
208,Not a fan of the new beyond beef/burger recipe,"I guess they updated their recipe. But it reminds me more of the gross burgers they used to serve at lunch when I was attending public school. 

I really am not a fan. Which is sad, because I absolutely loved the old recipe.",vegan,_FailingStar_,1572639201,5,True,2019-11-01
212,Accidentally vegan in Spain (particularly Málaga and SuperSol)?,Would appreciate some recommendations for supersol finds or places to eat in Malaga?,vegan,sweetpotatofamily,1572640846,6,True,2019-11-01
218,Making a grocery list,"I am going vegan as of today/tomorrow. What are staples in your kitchen? Things you keep around always that you can’t do without. Besides beans, lentils, quinoa, and rice. I cook Indian food pretty often and have a slough of spices and can always pick up more based on recommendations. I’m planning on getting some tofu from Trader Joe’s and I’m looking forward to learning how to make it tasty. Planning on getting Ezekiel bread. Also going to get fresh veggies and fruits of course. Specifically kale, frozen blueberries, broccoli, spinach maybe, and sweet potatoes. 

Want to make sure we have a good variety to make sure we are getting all the necessary nutrients.",vegan,thedrawingroom,1572645002,8,True,2019-11-01
219,Things I learned after becoming Vegan,"Things I learned after becoming Vegan;

• If you feed animals and care for them temporarily, it's perfectly fine to send them to slaughterhouses, scare the living shit out of them, fire a bolt into their head and cut their throats. This is known as 'respecting the animals'. Thanking them for their 'sacrifice' (when they had no choice at all anyway) makes everything perfectly fine.

• Non-vegans buy their cow lactation fluid from ethical, non-enslaving, non-exploitative, non-harmful, beautiful green pasture farms that treat the cows like absolute royalty. All of the animals live their entire lives happily giving their lactation fluid to humans instead of feeding it to their babies. The cows and their babies grow old together and die naturally in their sleep. Cows exist solely for human benefit.

• As a society and species, we should exploit every animal on this earth. Exploiting and slaughtering animals is consistent with 'conservation', and this word makes us feel better about exploiting and slaughtering animals. Oh, except dogs and cats, who should be treated like royalty and are exempt.

• We should be angry at people who hurt animals, however we should ignore and defend the hurt, exploitation, slavery and pain that the animals in our fridge/freezer endured.

• Kicking, hurting and killing a single animal is absolutely not okay, however building large sheds/factories and hurting and killing millions of animals is logical and perfectly fine.

• When presented with facts that list compassinate and logical reasons to make changes to our lifestyles, it is easier to ignore and avoid the facts and continue on a path of destruction and selfishness. Changing our mentality and actions for the benefit of others is absolutely out of the question and illogical. Except for recycling at home. Recycling helps the environment and makes us feel good.

• If other people throughout our history have made the conscious decision to enslave, exploit and kill others, we should do it too. It makes sense. Exploiting and slaughtering others is what we should all do as human beings. Conscious decisions to have compassion for others is out of the question and illogical. Slavery and slaughter are what we should live for.

• Protein is what makes us human. I don't know what it really even is, but if other people say it enough times I should just repeat it too. We need to get protein from animals. That is our justification for enslaving and slaughtering animals daily.

• Although there are millions of people worldwide who survive perfectly fine eating plant foods, which is better for the environment, animals and far more sustainable, we should avoid this at all costs. It makes absolutely no sense to help anyone else, nor ourselves. We should continue to consume things that put us at greater risk. Our lives and the lives of others are not important.",vegan,techzeus,1572645148,9,True,2019-11-01
220,Beyond Burger: The Uncanny Valley of Veggieburgers...,"This review is so spot on.  Give me a good ol' spicy black bean burger.  I feel like trying to emulate real meat to this degree results in disappointment for vegan and meater-eater alike...

[https://youtu.be/mWrpneBgCw8](https://youtu.be/mWrpneBgCw8)",vegan,WhiteMountainFarm,1572645771,0,True,2019-11-01
221,Trying to substitute Eggs on Toast and Greek Yoghurt..,"Hi all, I'm on my journey to try and turn fully vegan

I recently substituted my lunches at work to be a combination of tofu with various vegetables and vinegar which i really enjoy.

My next aim is to substitute 

1) Eggs on toast which i have for dinner and i love as they are super easy to make (5 minutes), not messy in terms of cleaning up, high in protein and low in calories as well as very tasty. Preferably not with another tofu recipe

2) Greek Yoghurt 0% - very low in calories and a high protein tasty snack. I've tried alternative vegan yoghurts but have not liked any. Just looking for another low calories, tasy substitute that is vegan (doesn't have to be comparable to greek yoghurt in actual taste, just in calories, protein and in how tasty it is)

&amp;#x200B;

I know sounds like a lot to ask, but am struggling so was just wondering if anyone had any ideas? Thank you!",vegan,Bdoskail,1572646050,7,True,2019-11-01
223,Feel sick after being fed a duck roll having been told it was veggie,,vegan,Sheepski,1572646347,3,True,2019-11-01
226,Why I Am Not a Vegan,"I am an organic vegetarian which means I only eat organic vegetarian food. I’ve been this way for 5-6 years and I feel great. Some people ask if I am a vegan and I am not one. 

I am not a vegan because vegans eat things that I would not give to animals or put in landfills. The food they eat is contaminated with pesticides, herbicides, fungicides, insecticides, etc. It is also grown in sludge (excrement) and has GMOs in it. These things tend to be bad for the human body, the environment and other lifeforms. 

I consider honey to be medicine, so I enjoy swallowing a little each day. Vegans are apparently divided on it, but they tend to avoid it because bees make it. However, honey has health benefits and I think it has benefits that we’ve been unable to measure. There is nothing like it too. Agave and maple do not have the same benefits. 

Organic food can’t have table salt in it because it contains synthetic additives like sodium aluminosilicate, silicon dioxide and magnesium carbonate. It also can’t have high fructose corn syrup, hydrogenated oils or artificial sweeteners in it. 

Organic food is healthier than vegan food. For instance, vegans eat processed food, but organic food is unprocessed or minimally processed. It can’t include synthetic preservatives, artificial colors or artificial flavors to be USDA certified organic food, but vegan food can have those additives. It also can’t have synthetic antibiotics or synthetic hormones in it. 

The human body is organic. Yours was organic. I think food is like medicine or poison and you have to make the right choices to become healthy and stay healthy. The healthiest diet you can eat and the best one for the environment and other lifeforms is an organic vegetarian diet. 

Some people eat with a lot of faith, but I don’t. I hope you eat the healthiest food that you can find and experience good health. The old adage “an ounce of prevention is worth a pound of cure” is true. Good luck.

[Source](http://jasongastrich.com/blog/#whyiamnotavegan)",vegan,1sdkid,1572646686,0,True,2019-11-01
234,"Best machine to shred cabbage? And simplest way to flavor it with a very small number of ingredients, excluding ranch? Trying to make a large batch of flavored red cabbage to munch on throughout the week","Anyone tried out a machine that can easily cut cabbage and is easy to clean/idiot proof in terms of making it very hard to accidentally cut your fingers when you are cleaning the machine?

&amp;#x200B;

1,  What machine have you tried? 

&amp;#x200B;

I am planning on making a giant batch of shredded red cabbage to munch on to increase my vegetable intake. I am brainstorming some ways to flavor it without adding too many calories or requiring more than a few ingredients. The youtube bodybuilder scooby1961 had some ideas [https://www.youtube.com/watch?v=qy5cHheCZSE](https://www.youtube.com/watch?v=qy5cHheCZSE) but I'm looking for something even simpler 

&amp;#x200B;

2. If you had to limit flavoring the red shredded cabbage to three ingredients or less excluding the cabbage, what would you go with? 

Vinegar, right? I tried just vinegar on cabbage and I am trying to find another ingredient that can add some calories/pleasure without adding too many calories to the shredded red cabbage.",vegan,Day0Precise,1572647422,5,True,2019-11-01
235,How do any of you deal with omni SO,"My bf wants to go to a zoo and I told him I wouldn’t be going because I don’t want my money to go to that. His reply was “well they’re already there and I like animals”. Being a vegan, that reply made absolutely no sense to me. But it’s still very frustrating that he thinks that being vegan is just eating plants. Any of yall have similar experiences?",vegan,lgc97,1572647607,4,True,2019-11-01
242,I love Beef,[removed],vegan,Thisisdumb377,1572649599,0,True,2019-11-01
247,Day 6,"Today I ate baked tofu. I recovered from my lack of awsome Halloween candy. I had a long day at work as usual. I felt energized today. I slept very little last night but I did not feel tired durring the final hours of my work day. I am wondering if this is a result of a better diet or just coincidence.

Baked tofu with garlic salt and pepper
Broccoli 
White rice

Also ate peanut butter, apples, banana and some homemade French fries cooked in coconut oil to round out my day",vegan,Ethwood,1572653290,1,True,2019-11-01
248,serious: Can prison inmates eat a plant based diet? Can they be vegan?,,vegan,r5ro,1572653570,6,True,2019-11-01
250,Is thriving on a vegan diet impossible in france?,"Currently 5ish months vegan, and i may have the oppurtunity to travel to paris with my family next fall which is so lovely but i know france has a reputation of being an extremely vegan unfriendly country and id like to ask if anyone who lives in or often travels to france has any input?",vegan,eighttorches,1572654172,5,True,2019-11-01
252,What to do with cockroaches in your house?,"Luckily I don’t have to face this problem a lot because I don’t get cockroaches in my house often but I’m not sure what the ethical way of removing them would be. I know the best thing is preventing them from getting inside to begin with but this doesn’t always work. I take every bug including spiders outside every time, but cockroaches run fast, fly, and are very hard to catch in general. So what do I do?",vegan,melanicholy,1572654540,4,True,2019-11-01
255,Vegan helping vegan,"I found a nice cell phone recently; it took two weeks but was able to track down the owner. We had little communication and she didn’t know I was vegan; when I returned the phone to me she thanked me with vegan cupcakes, she happens to be vegan too. 
Super cool.",vegan,lewvsal,1572655345,0,True,2019-11-01
257,Concerned about my parents’ health,"My dad has high blood pressure, a stressful job, and chronic back pain. I talk to him about how a vegan diet would help, and he doesn’t even give it a try.. he says that since I’ve been vegan he’s eaten less meat. I try to tell him that that’s not enough to help his problems, and that the cholesterol pills he’s taking isn’t reliable in preventing heart disease/attack. I understand that I can’t force a lifestyle change on anyone, but what can I do to hopefully help turn him over? I’ve sent him a few health videos but he doesn’t seem to take them seriously.  

As for my mom, she’s very convinced that grains are the enemy, and she is much less open minded about veganism. However, she has a lot of problems with her energy and memory, and I think being vegan would help her. I don’t know how to bring this up to her at all though, because she will get angry and defensive when I talk about how being vegan is healthier. I think she’s also convinced my dad that grains are unhealthy. 

I think their attitude on this is partially my fault, for when I went vegan I was quite angry at how other people don’t seem to care about the animals/planet as much as I do. I’m really concerned about their health though, and would like to help them. What can I do?",vegan,treeeeeeeee96,1572656477,7,True,2019-11-01
263,I'm not yet a vegan,"I normally don't eat meat, but would do it occasionally, especially in social occasions, now after watching these videos:

 [https://www.kinderworld.org/videos/meat-industry/what-animals-feel-before-slaughter/](https://www.kinderworld.org/videos/meat-industry/what-animals-feel-before-slaughter/) 

I feel I don't want to do it AT ALL...",vegan,chicomigrania,1572659008,2,True,2019-11-01
265,HOW DO I BECOME VEGAN ?,I don’t know how to become vegan I don’t want to hurt animals anymore:( :(,vegan,joemama69420911,1572659260,10,True,2019-11-01
266,Help!,"I am trying to help a friend in her journey to veganism. I have shared the facts with her, and she says it ""scares her,"" and ""gives her nightmares."" It scared me too, it's horrible what happens in slaughterhouses and farms. But she keeps eating animal products despite loving my vegan food. I am confused and not really sure what I have done wrong.",vegan,em2oo1,1572659277,5,True,2019-11-01
268,Reminder to upvote!,Want to partake in some seriously easy and effective activism? Stop lurking and start upvoting. Getting vegan content in the public eye is a profoundly important thing we can do everyday.,vegan,dogofman92,1572659795,8,True,2019-11-01
273,Recs for vegan cookbooks?,"Hey guys, I’m looking to delve into veganism more seriously (finally) and I was wondering if anyone had any good cook books they like? Cooking is a huge hobby of mine so the prospect of finding some involved recipes beyond the obvious is exciting. Any help is appreciated!",vegan,ShutYourButt420,1572660379,1,True,2019-11-01
276,What you gonna call me?,"I've decided to not eat mammals anymore. Ethical and environmental reasons, mainly. I'm not a vegan, I'm not a vegetarian, I'm not a flexiitarian. What word best describes my culinary choices?",vegan,wheresmywanksock,1572660830,67,True,2019-11-01
277,Looking for responses,How would you guys feel if a carnivore opened a vegan restaurant and was fully in charge of creating the menu?,vegan,KiaPia,1572660873,21,True,2019-11-01
278,Anyone celebrate world vegan day?,"I didn’t even know it was a thing until one of my students gave me a wrapped present and said happy world vegan day. 

It was a tin of black beans.",vegan,amyousness,1572663690,4,True,2019-11-01
281,I only eat chicken am I vegan?,,vegan,sebenenwn,1572664572,12,True,2019-11-01
282,Hi! Little help in arguing with non vegans,"Whenever I tried to endorse veganism among my friends and family, people say ""even plants feel pain.. do you have selective empathy?""

I try to explain 
our bodies are designed to be vegetarian, 
plants have consciousness far small compared to animals
Etc., But I think this is not enough material to debate in this topic, because there are many studies that explains how plants feel pain, and initially I doubt myself if veganism makes sense at all!! Little help in this area would be appreciated.. Thanks",vegan,aksandula,1572665022,15,True,2019-11-01
283,I raise pigs and I've noticed something that makes me want to eat them even more,[removed],vegan,wnwwwmwne,1572665289,0,True,2019-11-01
284,"“So, you can eat shrimp, right?” ...And that’s how an argument with my wife started...","After I explained that I was done eating and using meat, fish, dairy, literally any animal product, she asked “why not milk? Milk is natural.” I explained there’s nothing natural about humans drinking cow milk, which is different than human milk. Anyway, anyone else have a spouse that isn’t on board? I imagine I’m not alone in these kinds of conversations with spouses.",vegan,goodjiujiu,1572665383,31,True,2019-11-01
286,A Passionate &amp; Dedicated Vegan VS a Flesh Loving Mother…,"can I get a list of foods/ingredients that a vegan should always have? I want to learn how to prep vegan. since I've gone vegan my mom has been trying to force meat and dairy into me by lying about foods. the only reason I've caught her is with my sense of sight with textures &amp; sense of smell. Yes I've prep'd food. I've made food that's usually cooked with flesh but I've done it by substituting it with veggies or play based 'flesh'.

My mom says she loves animals but can't get it thru her fat head the facts why I won't even consume dairy, wear leather, etc. and why others shouldn't either.

This happened yesterday:

I explained in detail how we get cow milk. She made a 'joke' saying ""I'm hungry, I want chicken. Oh well!""",vegan,ytskny,1572666063,3,True,2019-11-01
288,"Can I get links to the most gruesome videos on how humans get dairy? because since my family has no interest in informing themselves, they make jokes &amp; laugh about animal abuse, talk crap on vegans &amp; try to sneak meat and dairy into my food. Spanish is best (parents understand it best)",,vegan,ytskny,1572666913,2,True,2019-11-01
291,Rabbits eat their own babies yet you care about them why?,[removed],vegan,wnwwwmwne,1572667322,6,True,2019-11-02
293,what if dogs?,"dogs aren't vegan, but sometimes they eat vegan. what if a dog ate honey?",vegan,SpaceMonkeyPolice2,1572667527,5,True,2019-11-02
295,Meat is so good how can you not eat it,[removed],vegan,wweedjdjej,1572670051,0,True,2019-11-02
298,Milk chocolate chips?,I am looking for vegan milk chocolate chips (or any other chocolate you can buy in bulk - something like almond bark). All I can find is dark or semi sweet. Any suggestions?,vegan,thebadsociologist,1572670843,0,True,2019-11-02
299,Hi r/vegan community!,"36 year old female, lifelong meat eater here. Watched Game Changers on Netflix which piqued my interest - followed by Forks over Knives, Cowspiracy then started Dominion on YouTube and noped the hell out of that after about 6 minutes. Omg guys. This last week has been full of heartbreak, tears and lost sleep as I've gone down the rabbithole of what is actually involved in the meat and dairy industry and those poor, poor animals :(    


Since I've been reading all your posts and searching vegan recipes EVERYWHERE (there's so many!) I thought I'd better pop in and thank you all for sharing your experiences and linked studies and websites that've helped debunk myths I've held and made this process a hell of a lot easier. It's only been a week, but I know this is me for life. Thanks all!",vegan,bambootaro,1572670948,52,True,2019-11-02
300,Eating wild carnivores: Could it be moral?,"I’m a long-time vegetarian but I’ve recently begun to wonder if eating wild carnivores (specifically certain fish) might actually be more moral than not eating them. 

Salmon, for instance, claim hundreds/thousands of lives. Killing one of them would spare so much innocent life. 

Can someone talk me out of this?",vegan,tandemxarnubius,1572671845,11,True,2019-11-02
301,Were you vegan or zero-waste first? How long did it take you to become one or the other?,,vegan,ytodysm,1572672016,11,True,2019-11-02
302,Do you know any tasty vegan yogurt with probiotics that I can get from Walmart ?,,vegan,throwawayloveandlife,1572672972,4,True,2019-11-02
303,Vegan Restaurants in Phoenix?,"I'm in Phoenix for the weekend, and was wondering what y'all recommend for all breakfast, lunch, and dinner?",vegan,chipsandssalsa,1572674108,10,True,2019-11-02
304,Vegans are extremely,,vegan,wweedjdjej,1572675559,0,True,2019-11-02
306,What are some good egg replacements for baking?,"Heyy im a new vegan and I'm going to be baking today but one of my favorite recipes i used to make has an egg in it... How do I replace that?
I can't really think of a good alternative",vegan,hondenkoekjes,1572677654,9,True,2019-11-02
310,Any tips?,"Any tips on how to start and maintain a vegan diet while also having a family of 4 who don’t want to go vegan? That would mean painstakingly dividing the meals and cooking alternatives for just me for every meal, not to mention the cost of buying „double“ ingredients.",vegan,cptstriker,1572678976,5,True,2019-11-02
313,Travelling to French Caledonia. Worried about limited availability of vegan food.,"I’d love your suggestions on how to travel vegan. I’m relatively new to veganism, so I haven’t done any vegan travelling before. I’m worried that I’ll struggle to find vegan options. I’m travelling with non-vegans which makes it harder. As much as I like fries, I’d like to be able to eat something else during my week away.     
What has worked for you previously? Have you brought your own emergency backup foods?     
I’ve checked Happy Cow but there is very little near where we will be 😓",vegan,Watermelon235,1572680845,0,True,2019-11-02
315,Tips for travelling vegan to a destination with limited vegan foods?,"I’d love your suggestions on how to travel vegan. I’m relatively new to veganism, so I haven’t done any vegan travelling before. I’m worried that I’ll struggle to find vegan options. I’m travelling with non-vegans which makes it harder. As much as I like fries, I’d like to be able to eat something else during my week away.     
What has worked for you previously? Have you brought your own emergency backup foods?     
I’ve checked Happy Cow but there is very little near where we will be 😓",vegan,Watermelon235,1572681455,11,True,2019-11-02
318,Emotions related to veganism,"Hey guys. I wanted to know how you guys deal with emotions related to veganism. 

Let me give you my experience. I have been vegan for almost a year now, and have recently got involved in activism as well. Personally, I find it very hard to deal with the fact that millions of animals are suffering at this very moment. Even though I am doing my part, I'm always picturing a scared cow being dragged to the kill floor, or pigs screaming while being gassed to death. And these things are actually happening and aren't just made up thoughts. 

I find it hard to enjoy anything these days. What right do I have to enjoy myself while these horrors are happening right now? I know this isn't a good attitude, but I would like to know your experience as well. 

Thanks guys :)",vegan,Veganmathematician,1572689147,13,True,2019-11-02
321,With Game Changers being so popular what arguments or “debunking” is going to come out against it?,,vegan,xyzxyz8888,1572691816,8,True,2019-11-02
322,I just got banned by r/Diabetes because they are so ignorant to the truth its spam to them,"I explained to a post saying that he just got diabetes, that its because he was eating too much long chain saturated fat from animal products and oils etc etc. Explai

Provided links and explained that they must see ""What the Health"", the Nutritionfacts.org ""what causes insulin resistance"" video, Masteringdiabetes.org, Dr Neal Banards work, and they arrogantly call me an idiot because ""there is no cure"" yet as vegans we all know there is and have seen thousands fixed and able to metabolise glucose normally again. 

That sub is a bunch of fools that are destined to be sick forever because they are close minded. As if you couldnt try something new for a month as simplebas a diet change that could fix what you have not been ablentoo for years, the science is very strong here.",vegan,OnYourKnees4Jesus,1572691828,41,True,2019-11-02
325,"Internal between men: Once you go vegan for more then 1 year, you never go back. You know what I mean😉",Am I right?,vegan,Thriathl0n,1572693158,7,True,2019-11-02
328,"Why does Hong Kong, as the most meat-eating region, has the lowest rate of hearth disease?",,vegan,spynimal,1572696029,10,True,2019-11-02
331,'Vegans' that believe that 'people should eat whatever they wanna eat' are not truly vegans. Change my mind,"A lot of ""Vegans"" think that a good vegan is someone who is silent and complacent and  never actively communicates our beliefs. 

But this is so wrong. 
When you know that there are animals being abused and killed every second, the environment is dying and climate change is a thing HOW THE HELL CAN YOU STAY SILENT AND ACT LIKE NOTHING IS HAPPENING?

This movement is taking so long to change the world and save the environment and the animals because of those nice non-pushy silent ""vegans""

If you are one of those 'vegans', stop acting like nothing is happening. Go out there and do you part.",vegan,Marco_the_Vegan,1572697871,54,True,2019-11-02
332,What do you think about hunting?,Hunting is more ethical than eating Brian's because less killing of birds and bunnies that get killed while raising crops,vegan,veganbaconisnotgoof,1572698552,0,True,2019-11-02
333,"[Not Serious] Yesterday I made vegan (beans, soy and homemade ""cheese""sauce) tortillas for a party, and now they complain that they spent most of the evening in the toilet.","So, any one of you know the contact information for Taco Bell? I'm going to make millions!

(but Yeah... Caused a shit explosion with my vegan dish. It was still delicious)",vegan,therealviiru,1572698769,8,True,2019-11-02
