,title,selftext,subreddit,author,created_utc,num_comments,is_self,timestamp
344,How much per day do you strive towards eating?,"Whether that’s low carb, high fat, how many calories, etc. 
Please be kind. I lost 60 lbs from going vegan and I feel like my eating habits in regards to counting my macros are getting toxic. 
I’ve had difficulty figuring out how much other vegans eat per day in order to maintain weight. 
I’m awful at intuitive eating because I’m obsessed with tracking my nutrients, and I’d really like to get better at it and be more lenient about my diet.",vegan,crystal0001,1570107697,4,True,2019-10-03
346,What should I do with unwanted food?,"This might be a dumb question, so apologies in advance if so. I recently decided to go vegan, but I still have some non-vegan food that I don't know what to do with. Some of it is non-perishable like canned tuna, and I figured I'd donate it to a food bank, but what should I do with stuff like eggs? I'd feel wasteful throwing them away, but I don't really know what to do with them otherwise.

Thank you!",vegan,lodi_,1570109017,8,True,2019-10-03
347,"""Controlling the population""","I live in Texas where hunting culture is huge. The other night when I was hanging out with some friends, they started talking about going hog hunting together. The conversation then turned super weird with them all telling me how harmful wild hogs are and how they're digging holes in someone's uncle's cow pasture. Like, they're doing this huge humanitarian thing by hunting hogs and saving dozens of cows from having their legs broken. 

Could y'all give me some insight on this? Some good counterpoints for when this comes up in the future? I can't get past the fact that they're making a fun time out of going and murdering animals, but I don't know a good logical counterpoint when they're talking about ""controlling the population"". Like, everyone's always talked about it growing up, like wild hog/deer populations will get huge and destroy the ecosystem or something.

Sorry if this is a dumb question. I'm still pretty fresh to veganism and I'm trying hard to inform others.",vegan,BBRittz,1570109264,5,True,2019-10-03
348,Vegan Antihistamines?,"Hello,

I've been having an allergic reaction to something unknown and my doctor recommended taking Claritin during the day and benedryl at night. I just noticed, however, that claritin has lactose momo hydrate",vegan,bluethroughsunshine,1570109789,2,True,2019-10-03
350,anyone else eat literal POUNDS of vegetables per day? it seems like i have a bottomless stomach,"i absolutely LOVE vegetables.  i literally cannot get enough.  i am quite active and have relatively high caloric needs - about 3500-4000 per day - and although i do use some high-calorie foods like nuts to get some extra cals, my dinners are often 1200 calories of massive vegetable stir fry's... something like 300g of broccoli, 300g of sproouts, 300g, of cauliflower, 300g of carrots... it can easily be like 1.5kg of total vegetables (before coooking).  

i often have a ""food baby"" after this due to the sheer amount of foood, but the calories are pretty low and i'm not gaining weight.  does anyone else do this - have literal pounds of vegetables per day?  part of me wonders if all that fiber is bad even though i experience noo discomfoort or GI distress.  everything runs very smoothly in that regard.  as far as i can see thus far, the only downside is that my stomach capacity seems to have groown a lot because of the sheer volume so ii feel unsatisfied when i dont eat a lot of volume lol.

does anyone else live like this or has been doing it for a while?  experiences?",vegan,question8r,1570111727,4,True,2019-10-03
354,New vegan - advice?,"First of all, sorry if this has been frequently asked, I have tried to search for a similar post but I couldn’t find any. Happy to remove it if there is something I missed though! Short context, I have been researching veganism for months, find something to convince myself I shouldn’t do it, be “fine” and ignored it for a few weeks but kept coming back to it. I finally made the choice that I’m done making excuses for myself and went vegetarian 2 weeks ago, now I can’t stop looking into veganism but felt like I needed a push. I just watched 15 minutes of Dominion, couldn’t watch any more and cried almost the full 15 minutes. So I’m done, I can’t make any more excuses, I am (want to be, from now on) vegan. 

However my struggle (and why I made this post) I still have some stuff in my pantry that isn’t vegan or vegetarian (for example a bolognese pasta sauce, some cookies/crisps that contain dairy, that kind of stuff). I am torn between throwing these things out (or giving them to my roommate?) or just finishing them because they are already bought. I hate the idea of wasting food, but I feel weird calling myself vegan while I eat these things? I would of course not replace them after they’re gone from my pantry. If anyone has some insight to offer here that might help me make a decision I would be grateful. 🌱",vegan,Alizorae,1570112395,7,True,2019-10-03
360,Vegan options at the Tottenham Hotspur Stadium?,"Despite living so close to WHL/THS stadium all my life, I've never had the funds to go to a match. I plan to go there soon with family.

Has anyone been there? Are vegan options available? I'd ask on our subreddit, but I don't want to get flamed. TIA x",vegan,garoena,1570113424,8,True,2019-10-03
361,Hair loss as vegan,"Hi guys!
I've been vegan for almost a year and recently I noticed that I'm loosing my hair pretty fast. I'm still young, so it's pretty scary for me. Can I ask you what's reason for this? Did you had the same problem?",vegan,Tonnuncausewhynot,1570113435,14,True,2019-10-03
363,Best vegan documentaries?,"I just watched cowspiracy last night and I'm trying to get my mom to watch it now (I really want to be vegan and it would be so much easier if she tried to do it with me)

What are some other must watch documentaries?",vegan,SpaceSnake95,1570114108,10,True,2019-10-03
365,Anyone know of vegan birthday freebies?,"Anyone know of vegan birthday freebies?  


In the past I always enjoyed looking up business freebies on my birthday and I loved going around town like a birthday trick or treat for desserts. (Don't worry, I patronized the businesses too. I would feel too guilty otherwise.) Does anyone know of any businesses that participate in this tradition that are also vegan?",vegan,DangerUnicorn_27,1570114340,2,True,2019-10-03
369,Any questions for beef and lentil farmers? (Serious),"I'm at a conference for agriculture and climate change, pretty interesting stuff. Anyone have any questions? This is in Montana, not a huge room, but a few beef producers, bee keepers, pulse crop farmers, wheat farmers. I will say lentils and pulse crops are cheap AF and that's not so good for them.",vegan,Orange_Crawler,1570115397,28,True,2019-10-03
370,Kite Hill,"I haven't been able to find any Kite Hill products in any store in WEEKS. What's going on? I can't seem to find anything about it. I've been craving bagels for as long as I haven't been able to find their products anywhere. I'm miserable. 

Is anybody else having this problem?",vegan,earthlingfairy,1570115631,3,True,2019-10-03
371,Can we stop comparing fucked up human beings with animals?,"You heard it before, someone does something terrible and disgusting, and are called an animal. Or a disgusting person is called a pig.
Animals are way better than us humans, only humans can commit such outrageous acts, hurt each other for no reason, deliberately prey on children, have affairs despite knowing exactly how it will make their lovers feel and murder each other for nothing more than personal gain or anger or jealousy. Only humans breed animals in big, ugly factories, torture them and steal their children, rape them and keep them locked up in tiny cages, cut off their limbs whilst they're still screaming and grind baby chicks up alive for their chicken nuggets, and then call their diets natural and compare it to the animal kingdom and the circle of life. 
I trust animals way more than I trust humans. Being compared to an animal is a compliment, not an insult.
Just saying.",vegan,syrollesse,1570115919,5,True,2019-10-03
372,How do yall feel about meat eaters who go vegan when they can?,"I've been vegan for a few days, but it won't be permanent. However I can see myself doing this often, like always getting the impossible whopper when I go to Burger King, completely switching to vegan milks, limiting eat consumption to 3 times a week etc.",vegan,greatrater,1570115930,3,True,2019-10-03
373,Non-vegan Liquor from before transition,"I’ve been vegan just over two months and I have some American Honey Wild Turkey from my birthday in May. I can count on one hand the number of times I drink a year so it’s just sitting there waiting to be used. On that note, if I’m honest I don’t feel guilty about the thought of drinking it. However, on principal it seems wrong and I’d feel like a fake vegan. What if it was a steak I had in the freezer since before I went vegan? I wouldn’t feel okay consuming that. But my leather wallet from before the transition gets a pass. Where do you draw the line and do I bin the liquor? Thanks guys!",vegan,GlobbyBottle,1570115932,3,True,2019-10-03
376,So this happens,I ate a burger it tasted like a big fat cow on a grill . That night I swore on my life that I won’t be vegan and here I am. Never eating veggies again .,vegan,dad-ded,1570116827,6,True,2019-10-03
377,"According to my family, fruit and carbs are ""poison"" and will give you diabetes, GMO's are evil, every vegan they've seen has been emaciated and veganism is a ""cult"". Where do I even begin when talking to them? I'm not great at debating.","I figured I'd face adversity from my family when I became vegan...but goddamn I didn't expect to hear that bananas are supposedly evil lol.

They even threw out the whole ""local farmers treat their animals right"" line...

Is it even worth arguing with them or trying to show them information?  I don't even know where to start.",vegan,melonslab,1570116885,13,True,2019-10-03
388,which meat and dairy alternatives do you consider staples that you almost always have on hand at home?,"for me, I always have [Miyoko's mozzarella](https://miyokos.com/products/fresh-vegan-mozzarella-cheese), [Follow Your Heart American slices](https://followyourheart.com/products/american/), [Original Silk protein milk](https://silk.com/plant-based-products/plant-based-protein-beverages/), [Silk Plain Yogurt](https://silk.com/plant-based-products/dairy-free-yogurt-alternatives/plain-almond-dairy-free-yogurt-alternative/), [Vegenaise](https://followyourheart.com/product_category/vegenaise/), and [Gardein meatballs](https://www.gardein.com/products/meatless-meatballs/?utm_source=google&amp;utm_medium=cpc&amp;utm_campaign=Gardein_Google_Brand_Beefless_BMM&amp;utm_content=MeatlessMeatballs&amp;utm_keyword=gardeinmeatballs&amp;utm_siteid=gardein).

I also almost always have [these](https://www.morningstarfarms.com/products/morningstar-farms-veggie-corn-dogs-product.html) too, but I like them a little *too much* tbh",vegan,fappingatyourfuneral,1570119775,16,True,2019-10-03
391,Tomatoes in Winter?,"Hello everybody, I'm from Austria, central Europe, and was wondering what you do about tomatoes in winter? I turned vegan only a few weeks ago and never really cooked much or payed attention to fresh vegetables when my family cooked, but now I am wondering about the tomatoes in winter: they are not in season and mostly very white and tasteless, but I love them fresh and make fresh tomato sauce from them. So what do you do in winter to get your fresh tomatoes? Do you make sauce in autumn and freeze it for the winter? Do you have a substitute or an alternative? Thank you!",vegan,Crancloudy,1570120388,10,True,2019-10-03
392,Looking for some info,"Hello.  I'm new to the vegan world and guess not fully completely vegan yet as I'm looking for some answers and insight that people can give.  A little background on me real quick is I'm 36, diabetic (T1.5 managed via diet/metformin) and also just had a minor heart attack.  I'm trying to make changes to prevent that.  Before my heart attack I was a 100% clean eater, berries, vegetables, dairy  and lean meat once or twice per week.  I am not a fan of supplements and prefer to get all my nutrients from whole real foods.  With being both diabetic and having heart issues they both seem to have conflicting nutritional needs...no carbs or sugar for diabetes...low fat, sodium for heart...which seems to leave almost nothing to eat.  After doing research and such I'm not as concerned about the carbs effect on my BG (although a little concerned about sugar in fruit, guess I""ll have to experiment)  but I'm concerned with nutrients and best ways to obtain macro and micro nutrients from completely clean sources.  Seems like the biggest issue is Vitamin B12 and protein (got most of my protein from dairy).  I read about almond milk fortified with b12 but every almond milk i look at is filled with crap on the ingredients list.  So TLDR I'm looking for some help on figuring out nutritional sources that are clean, and can add calories as right now I seem to only be at around 500cals for the day

&amp;#x200B;

Thanks for any help

Ben",vegan,sevalle13,1570120462,14,True,2019-10-03
395,My moms gonna try to stop me being vegan what do I do,I’ve looked into everything I don’t know what she wants from me,vegan,doodle_system,1570121165,12,True,2019-10-03
396,I would like to become vegan but my love for meat is too strong,"This post might be long

I want to become vegan because the planet is dying. Everyday I tell myself I should do it but I can't help myself but eating meat. I love meat. I love to see the fear in the stray dog's eyes before getting shot. So I decided to buy some tofu to try different recipes but none of them are good (at my opinion), because the tofu seems to taste too strong.

I decided to try liquid smoke but the taste is too strong. I also tried to fry soja beas but when I finish eating I am still hungry and I need to eat my meat. I found some really good looking dishes but I am a novice cook and I might need easier recipes.

Any tips to become vegan and to stop eating meat or any easy recipes that you like?",vegan,NIGG_KILL,1570121194,3,True,2019-10-03
400,The great cheese divide,So I’m looking to transition from vegetarianism to veganism and I’m looking for some tips for when I make the jump over. I generally eat a lot of cheese and the occasional egg. Looking at cutting off that cheese addiction. Any helpful tips would be great.,vegan,Fier_Hazard,1570121285,9,True,2019-10-03
401,so good,"&amp;#x200B;

https://i.redd.it/p45tlx3ewcq31.jpg",vegan,aidanjames22,1570121713,1,True,2019-10-03
403,Constant hunger?,"Hi guys! So I've been properly vegan for about 2 weeks now (I've been vegetarian for the past year) and I just have to ask. Does anyone else experience constant hunger?! Since I've gone vegan I feel like I'm constantly eating yet constantly hungry! And I don't know why because my diet isn't massively different compared to being vegetarian.

Please let me know i'm not alone in this! lol 

thanks!",vegan,almondmilk_paradise,1570121844,15,True,2019-10-03
404,Going vegan has changed my life,"A little history... I was in the hospital last Xmas with severe acute pancreatitis. My triglycerides levels were above 12,000 (they say they haven’t seen it that high before) Was able to get down to under 900 after the hospital. Then at my last visit to my heart doctor 3-4 months ago my levels were above 2000 (I wasn’t taking my medication like I was supposed to)... haven’t been taking it like I’m supposed to right now either but I’ve been vegan for 59 days now. Had my blood checked yesterday and my levels are 564!! This is huge!!! Still have some ways to go. Need to be below 150 but in a few months this is a great improvement! I’ll have to wait and see what my heart doctor thinks and what he would like me to do with the medication. 🥳",vegan,Ein86,1570121871,11,True,2019-10-03
409,Obligated to be tell people?,"One of the main reasons I've gone vegan is so I can live more of a ""moral life"" and I feel like this is the best way to do it. However, am I obligated to tell other that they have to live this way too? Like if this is such a great ""moral"" feat I'm commiting then shouldn't other people know? I keep thinking about how I should just do my own thing and do what I think is right and let other people do their own thing but on the other side how are people going to be exposed to vegan view points if they aren't expressed? It seems like a really thin line, and I'm wondering how you guys are trying to look at it",vegan,OrangeForHigher,1570122166,3,True,2019-10-03
410,I don’t get why all the hate?,"I am new to being Vegan and feel this is such a great time to make the switch with the strides you have all made before me. So before I rant I want to say thank you to you all for working so hard for this cause.

So I am working on this goal but I catch so much hell for it, and I don’t get it. I have a coworker/friend who daily brings it up. I tel her it seems to bother her more than it bothers me and ask why it’s such a big deal to her that I know longer eat meat. I was a little bothered today when she helped coordinate a company lunch and insisted on bbq, knowing they had 0 options that I could eat. I didn’t mind too much, especially since everyone else was excited but it was a little annoying. My vegetable and rice soup was delicious nonetheless. I just don’t get why people make such a big deal out of your choice. It has no effect on them personally but they seem to take a vested interest in trying to break you, get you to give up your goal? It’s like drunks with a non-drinker, “ah cmon you can have a couple drinks.” Even my wife, “when are you going to give this whole vegan thing up?” Anyone else getting so much friction for make one small change in their life?",vegan,middyko,1570122196,27,True,2019-10-03
415,Going Vegan from Vegetarian,"Hello,  my name is Grace! i’ve been vegetarian for about a year now and this week I decided I want to make the switch over to vegan! It’s been about two days now and I realize there is nothing grocery wise that my mom buys that I can eat (i’ve just been eating oatmeal) I plan on going grocery shopping tomorrow but as I am a teen and have never shopped alone I was wondering if you guys could tell me some of the starter groceries i’ll need? I really appreciate it and everything you guys do!! It does make an impact because I truly never imagined myself wanting to ever be Vegan but here I am!! 🌱",vegan,ariesiqn,1570122355,10,True,2019-10-03
418,Eat my dog,Is this vegan to eat my dog (I have Chinese origins),vegan,B0R1S44445,1570122590,0,True,2019-10-03
419,Peace,See guys we can live together in harmony,vegan,MrMeSoLonely_Ttv,1570122595,4,True,2019-10-03
426,In need of recipes and advices to become vegan,"I am currently a meat eater, trying to be vegan.

I want to become vegan because the planet is dying. Everyday I tell myself I should do it but I can't help myself but eating meat. I love meat. I love to see the fear in the stray dog's eyes before getting shot. So I decided to buy some tofu to try different recipes but none of them are good (at my opinion), because the tofu seems to taste too strong.

I decided to try liquid smoke but the taste is a bit weird in large amounts. I also tried to fry soja beas but when I finish eating I am still hungry and I need to eat meat to feel filled. I found some really good looking dishes but I am a novice cook and I might need easier recipes.

Any tips to become vegan and to stop eating meat or any easy recipes that you like?",vegan,NIGG_KILL,1570123426,5,True,2019-10-03
429,"Animals should NOT eat meat, NO TO 🍖🥩🍗🥓🍔🥚",[removed],vegan,Salad145,1570123648,4,True,2019-10-03
435,Vegans are retarded,[removed],vegan,edime_official,1570124116,0,True,2019-10-03
453,Is it worth it to be vegan?,"In my class alot of people are vegan now, i want to know the plus and cons of being vegan, thanks.",vegan,BrotherLongLegs,1570124986,7,True,2019-10-03
464,Meat,Animals are so tasty,vegan,ahmed42468,1570125646,2,True,2019-10-03
466,"Hello everyone, i would hugely appreciate any recipes that are vegan for things like cakes or sweet treats, I'm not rich so as few ingredients as possible would be great!","Ive recently had to change my diet, its a dairy intolerance, but Ive found vegan food is all I can really eat without feeling sick, I'm a decent cook and have not struggled with breakfasts or main meals, but I need some sort of cake/dessert that I can make for myself. Ive found some recipes that look good, but have a ridiculous amount of ingredients I dont have, so wondered if anyone knew any tried and tested easy yet tasty dessert recipes? 

Any advice really is appreciated!",vegan,allthekos,1570125789,7,True,2019-10-03
467,General internet rule reminder,"Don’t feed the trolls. Let the mods delete it. We’re getting raided right now, obviously. They’re bored teenagers. You’re not going to change their minds. Ignore it.",vegan,EclecticEel,1570125874,26,True,2019-10-03
468,Meat lol,[removed],vegan,i_honestly-dont_care,1570125928,0,True,2019-10-03
469,Hello vegan people. What's wrong with Eggs ?,"I'm eating ....""konservativ"" and I understand vegetarians and vegans, live and let living (leben u d Leben lassen). 
But I do t understand strictly vegans who think there way of life/eating is better then others. 

My questions is why don't you eat eggs, chicken lay them on mass and don't want them it's not like u destroy some kind of life, it's waste for the chicken ? 
So why not eat it if it's healthy or are chicken who lay eggs almost daily bred/cultured ?",vegan,KrumpaR,1570126006,17,True,2019-10-03
494,Watch out! Corpse munchers are trying to troll us by posting meat memes!,,vegan,tcvanren,1570127345,33,True,2019-10-03
496,Meat,Meat is great to eat.,vegan,Blue11Z,1570127512,1,True,2019-10-03
8,LA Vegans: is Doomie’s good?,I’m traveling there in a couple of months and there’s a Doomie’s not too far from where I’m staying.  Is it any good?  I’m also planning to stop by Grand Central Market and plan to arrive early for my flight back to go check out Real Food Daily as well.,vegan,ALilCupcake,1567379300,4,True,2019-09-01
10,recipes for vegans of color,"hello all

my ask : **please drop any recommended resources for recipes for/by vegans of color or consistently flavorful and good food !**

i'm pretty new to cooking and haven't reached a level where i can tell if a recipe is good or not + how to fix it, but i've spent a lot of time trying out vegan recipes with 300 5-star reviews that just end up being pretty bland and lackluster healthy soccer mom food. i've found the most success just making recipes not for vegans but that happen to be vegan, but i'd like to try getting more in to vegan-targeted cooking (using proper substitutions etc). indian and eastern-asian inspired food seem pretty big (which i love!) but i haven't found any knockout recipes yet.",vegan,hobeymustard,1567379600,10,True,2019-09-01
13,Is gelato vegan?,,vegan,that1weebwithacat,1567381344,11,True,2019-09-01
14,I'm just curious.,So if you are vegan technically you can't drive gas cars right?,vegan,Furry_boi_76,1567382227,6,True,2019-09-01
15,What’s your favorite milk in diy iced lattes?,"I’ve been trying different types/brands to make the best iced latte at home.

Please give me recs of your favorites! (No almond, unfortunately am not a fan.)",vegan,aaanaab,1567382478,4,True,2019-09-01
16,Cheese is addicting.,Any alterntive to replace Protein? I have a replacement would it be viable for long term?,vegan,Yunie_PC,1567382491,4,True,2019-09-01
18,"Any recommendations for Animal Sanctuaries in Sydney, Port Douglas, or Melbourne?","We are in Australia for the next two weeks and would love to see some native Australian animals, but almost everything we find seems to be a zoo. Most have options to pay for photos holding koalas etc where even the trip advisor reviews mention the animals seeming to be scared or uncomfortable. 

Years ago we did a tiger experience in my town and only found out afterwards how bad the place was regarding animal welfare, how terrible they treat the animals and I vowed to never go to a place like that again. 

Are there any legit animal Sanctuaries or something similar to visit in any of these cities that are good for the animals too?",vegan,HoochIsCraaaazy,1567383397,3,True,2019-09-01
20,Vegan hiking shoes,"This isn't urgent yet, but next Summer I'm going on a month long trip to Europe and want to start buying a couple things a month that Ill need for the trip. One thing I need is some good hiking shoes because I'll be hiking quite a bit. I'm new to this lifestyle and have never bought vegan shoes before, no less vegan hiking shoes. Anyone have any brands and/or websites or stores that I should check out? I'm hoping to find a good brand and then wait for a sale, but I have no idea how to even find out if a shoe is vegan. Help? I'm lost. Haha.",vegan,MaiaOnReddit,1567383478,6,True,2019-09-01
