,title,selftext,subreddit,author,created_utc,num_comments,is_self,timestamp
0,Misinformed and Misleading Vegans,"[I don’t eat animals]
It’s speculated that we evolved because we Did eat animals. Otherwise we’d still be up in the trees and we wouldn’t be here sharing our lifestyles with strangers on the Internet. I’m a vegetarian but I know that animals DO get killed in the clearing of land used to grow our crops. Vegans lie and say that’s only for grain farms to feed live stock but they Are lying. I’m a vegetarian but honestly it’s WAY BETTER FOR THE PLANET if we actually grew our own food. Otherwise you ARE supporting animal death. How many bugs and small animals died to grow our vegetables and fruits? I don’t know the exact number but if you say none... you’re lying. If you wanna start growing your own veggies I highly recommend the kratkey method of hydroponics. It uses less water and no electricity is necessary (you can just put it in front of a window). I do recommend getting some LED grow lights, though (you don’t need fancy ones). And I’d just like to add that you shouldn’t just people who hunt for food because guess what... they’re not relying on factory farms and it’s not bad for the environment (climate change is a result of a large population which relies on large scale production and agriculture). A good hunter is smart enough to not go after endangered species because they know they’ll be hungry tomorrow and they deserve to eat just as much as anyone else does. Most vegans rely on commercial agriculture which, again, kills animals. Growing your own food, growing what you want and need, will lead to less waste of all our natural resources. So don’t say you’re a vegan if you contribute to the death of animals by what you put in your mouth! Genuine veganism is much deeper and more difficult than vegans lead on. Just know that everyone with an agenda has just that, an agenda. Our planet is not designed to hold billions of people who constantly need to consume on such a large, greedy scale. Honestly, if you wanna save the planet, the best way to do it is for humans to come together and not make any babies even just for a year, until we can solve some of these very pressing issues which threaten all those babies futures anyway. It’s simple logic.

I posted this in a comment on Instagram, but I know it’s too important to share to not be seen. I hope this will be seen and people will be more properly informed about their impact.",vegan,commie4u,1577742251,0,True,2019-12-30
1,Is eating road kill meat ethical?,"So I was listening to a radio program while driving. They had a former vegan on who currently lives in Alaska. She reintroduced meat into her diet because where she lives, road kill of (moose and deer) are salvaged for human consumption.

People place their names on a list and are contacted when an animal is killed roadside. Said people drive out to the location to salvage the meat.

The argument is that letting the meat go to waste is unethical. The animal is not harmed intentionally and the meat does not go to waste. The flip side was that respect for the animal should be considered regardless.

I found the debate interesting and wondered what this communities thoughts were on the subject.

Thoughts?",vegan,JonMellor,1577742327,18,True,2019-12-30
3,"Very Vegan Burger from Toby Carvery, is the Burger Sauce actually Vegan?","Toby Carvery has this burger. I've had it before, and it is delicious, but I did notice it had burger sauce in it...

They are selling this burger, with the following:  A delicious Beyond Meat™ plant-based burger in a soft bun with lettuce, tomato, burger sauce and topped with a melting slice served with roast potatoes. 

Burger sauce? I've looked it up online, and Vegan Burger Sauce is almost non-existent?  I'm wondering if that's actually possible to make vegan burger sauce? if not, what on earth are they using to make it?",vegan,EeveeonE_,1577742735,1,True,2019-12-30
4,Bad start,"Whenever I think back on this I cringe. In about 2 weeks I'll be celebrating a year as a vegetarian. A few months after vegetarianism I started towards veganism by cutting out milk and cheese and slowly but surely have worked up to full vegan. 

But before I went vege I decided I'd have a ""last hurrah"" and went to a BBQ place with friends and loaded up on meat because I'd "" miss it"". A big part of my decision was I knew how poorly they treated animals before they ..you know killed them. And yet in my head just one more meal couldn't hurt. No idea what I was thinking and I look back on myself like a different person. 

Anyway my point is I know a lot of people are probably considering going vegan in the new year and are maybe going to think like me. My advise is don't do it. Rather than that spend your money by going and trying a really nice vegan restaurant instead and celebrate your new life.",vegan,sierra117x,1577743051,3,True,2019-12-30
5,How long to blend nuts for cheeses?,I'm trying to make a cashew and brazil nut based nut cheese and using my 1000w Ninja blender I just can't seem to get them to puree smooth. I've let them soak for 12+ hours and the only thing I can think of is to let them blend longer but I'm worried about burning out my blender. How long are you supposed to blend a nut cheese in order for it to be smooth?,vegan,Snarklord,1577743075,2,True,2019-12-30
6,Where to eat in San Diego,"Visiting San Diego, does anyone have suggestions on where to eat some yummy food?",vegan,veggie_lisa,1577743144,6,True,2019-12-30
7,Vegan snacks,What are the best vegan snacks to eat throughout the day that is cheap easy to make and filling and obviously tastes good.,vegan,manlykeshinkick,1577743973,17,True,2019-12-30
9,What to post on Facebook in support of Veganuary?,"I've been fully vegan for 2 o 3 months now, and I find myself gaining more knowledge and passion everyday, and I wanna share it with my Facebook friends, especially since with the new year. Is there a script of some sorts? Or can you all give me examples of what you'd write? Keep in mind I have posted about my transition to veganism and my posts were received v positively, but I haven't said why I've done it. Just sharing veggie recipes and talking about the food aspect of it mainly, not ethics yet. Thanks so much!",vegan,novacanehurricane-,1577744994,1,True,2019-12-30
10,the snack pies from 7-11 are accidentally vegan ? I’ve seen a few videos about it,I’m talking about the chocolate one too,vegan,disney33b,1577745080,4,True,2019-12-30
15,"Vegan beef flavored base has “natural flavors“. It says vegan tho.....… Could it possibly have something like actual beef flavor/extract or something, in such small amounts, that it’s considered negligible? i.e., “it’s only .00001g of beef extract, which has no meat, therefore, it’s vegan “ o_O",,vegan,Water-Temple,1577746319,4,True,2019-12-30
16,Best vegan chicken soup?,"Now that it’s flu season and everyones got their secret chicken soup recipes, are there any good vegan alternatives? Ginger potato soup?",vegan,carboNoblesse,1577746425,4,True,2019-12-30
19,What are the most caloric vegan milks one can make at home rather than peanut milk?,,vegan,lutavsc,1577746953,1,True,2019-12-30
20,Vegan Pregnancy - bad teeth,"I've been vegan for a few years, and recently had a baby boy. He's 10 months old now, and has yellow patches on the 4 teeth that have come through. 

It actually looks like a section of the enamel itself is missing. I'll be taking him to the dentist next week, but from what I've researched on the internet I'm pretty sure it's a condition called enamel hypoplasia. 

I've been down a rabbit-hole researching this, and it's lead me to vitamin K2. It's important for teeth development, and although the body can convert some K1 (found in veggies) to K2 (found in animal products), it seems like scientists are starting to doubt the efficiency of that. The research seems pretty new - K2 was only discovered in 2007 or something. 

I was diligent in planning all the usual nutritients you hear about - B12, D, calcium, etc. Buy I just hadn't heard or thought about K2.

Has anyone else experienced this? I have found other similar stories elsewhere but I don't know how representative it is. Or, anyone who was vegan throughout pregnancy whose kids have great teeth? I'm looking for some kind of confirmation or alternatively reassurance here.",vegan,OkMany1,1577747657,6,True,2019-12-30
22,My Vitamin &amp; Mineral Supplements research during vegan pregnancy,"My girlfriend and I are expecting a baby in February. Once I found out we were pregnant one of the first things I did was spend a night researching which vitamins and nutrients are important to make sure she and the baby have enough of these.
Generally we eat very healthy, almost completely organic, but still it is hard to get things such as B12 or Omega Acids from plants only, so wanted to be on the safe side and supplement to the daily minimum dose.
Below is a list of what my midnight hours on the internet returned in condensed form. 
In short my GF and our baby are doing great, and the doctor that is accompanying us during the pregnancy has stated that everything important is covered. Many people told me I should post this information somewhere so here it is.
If it is of interest I can link two three shops in Germany where vegan supplements are available, for example vegan Omega 3 capsules which was tough to find. (We tried oils first but didn't like the aftertaste) Just let me know...  (I have no affiliation with any shops whatsoever and am in no way being paid or receiving discounts etc. for this.)

Thought it might help others get started. I am NOT a health professional so please confirm this with your doctor and consider this basic information to start with only.


Phatty Acids
-  Omega 3 Acids from EPA and DHA saturated oils or capsules (200 mgDHA/day, essential for mother and child) 

Vitamins
- Vitamin B12 (10-50 ug per day)
- Vitamin B6 
- Vitamin B2 
- Folic acid (400 ug per day, ideally also before pregnancy)
- Vitamin A
- Vitamin C
- Vitamin D3 (20 ug/800ie per day) 

Minerals
- Iron
- Iodine (100-150 ug per day)
- Zink
- Magnesium
- Calcium

We've been taking Chlorella Tablets (B Vitamins) and and Marine Calcium tablets as they include a lot of trace minerals on top. 

The source of the recommended minimum doses etc. was the German PETA site which was a great starting point for us: https://www.peta.de/gesundemama 
I will try to add the remaining recommended daily amounts, not all were present on my print outs.",vegan,perikaryal,1577748873,0,True,2019-12-30
23,Is Chicken Tendies and Honey Mussy vegan?,,vegan,dddddj-stutter,1577748915,0,True,2019-12-30
24,Accidentally vegan?,What’s your favorite “accidentally vegan” treat? I’m a fan of Air-Heads!,vegan,soapymeatwater,1577749556,13,True,2019-12-30
25,How to cook tofu and what sauces do use with it?,"I’m in the process of changing my diet to veganism and am wondering if there are any specific ways to cook tofu. I’m assuming that you fry it but how do you know when it’s cooked enough? What simple vegan sauces can go with it? I’m thinking that soy sauce would work. I’m planning to have the tofu with rice, lentils, broccoli and cauliflower. Does tofu need seasoning?",vegan,princessamarine,1577750854,17,True,2019-12-30
26,Favorite easy/instant vegan meals?,"I'm disabled and right now im having an awful flare up and am unable to stand up and cook meals. I was wondering if any of you had some favorite and perferably cheap instant vegan meals

Thanks in advance 🥰",vegan,creamiepuffs,1577750985,2,True,2019-12-30
27,New Vegan,"i just recently started eating vegan so im still kind of in the process of finding foods and stuff that i can eat, i JUST found out that some veggie patties i had been eating had milk and egg in them and its totally my fault for not looking at the ingrediants more closely

i just feel so bad and a little sick knowing i was still eating those things without even realizing it

im not sure what flair to tag this post with if any, i just kinda wanted to vent a little bit bc im really upset with myself for that :(",vegan,orchats,1577751031,9,True,2019-12-30
28,all you snowflakes don’t know what real food is,"all you vegans are just denying the truth, meat was made to be eaten and it’s even supported in the bible. what you’re doing is unnatural and plain idiotic.",vegan,VaccinesAreHarmful,1577751425,0,True,2019-12-30
31,I’m slipping,"Hi y’all, just here for some encouragement.  I started eating Vegan around June of this year, and as of recently, I’ve been staring at all the food I used to love and just feeling empty inside.  Not like spiritually empty, but physically empty.  I noticed when I first started eating Vegan, I would feel full, but never satiated.  This leads me to eat all day long, but I never feel “full” even though my stomach feels full. This, mixed with some cravings has caused me to break on just a couple occasions and eat cheese.  Since I’ve gone vegan, these are the things I’ve had that have animal products.  

Two bites of Pizza Hut cheesy crust in October. 

A sliver of smoked salmon in November

Mashed potatoes with butter in them at Thanksgiving.

A full babybel cheese (this is my most egregious, because I thought about eating for a full hour before hand and I was in a very low place.  

A slice of cake at a party.  

And most recently, a slice of cheese pizza with all the cheese peeled off.  


I feel bad, I really do, but my plan is to go 100% in the new year.  I feel like I’ve cut myself too much slack, and each time (except for the babybel) my mishap was brought on by social pressure.  I’m familiar with the term Freegan, and part of me wonders if that’s a better choice for me, but I’m also sort of an all or nothing person, and the thought of hurting a sweet cow any more than I have in my life hurts me.  I guess partially, I needed to get this off my chest, but if anyone has been through something similar to what I’m going through in the transition period, I would love to hear your stories.  And if anyone has any new and unique foods that fill voids left behind by animal products, I’m all ears.  

I just want to go out and say this, I won’t be responding to angry or condescending comments.  If you say I’m not a Vegan, that’s fine, but not constructive.  I’m here for encouragement and thoughtful conversation, not hate.",vegan,Allan_add_username,1577752726,16,True,2019-12-30
33,Vegan as a resolution,[removed],vegan,TheWitchySpider,1577753087,16,True,2019-12-30
35,Looki g for vegan resources.,I'm new to vegan. I am looking for some (non-PETA) resources for vegan beginners.,vegan,InkWings87,1577753930,3,True,2019-12-30
36,Is the bun for the Beyond Burger at Carl’s Jr. vegan?,"All the information I have found online is contradictory. Some articles say that it is, and some say it isn’t. I was hoping I could order the burger without cheese and mayo and have it be vegan, but is this true?",vegan,Common_Chameleon,1577754209,7,True,2019-12-30
38,My mom got me a crockpot for Xmas... any recipes I need to try?,"In particular, does anyone have a good one for baked potato soup or potato and corn soup? 

Open to any recipes at all though! I want to try all the crockpot foods!",vegan,joyasumi,1577755087,2,True,2019-12-30
39,Does going Vegan have any affect on penis size?,For example if I stop eating red meat can it make my penis grow? I couldn't find any studies about diet and penis size correlation but if diet can affect every other physical aspect of your growth and body I don't see why the penis wouldn't be included.,vegan,UltraMarineMagmell,1577755105,24,True,2019-12-30
40,STOP PROMOTING MALNUTRITION (unless this is just a form of natural selection like when the dinosaurs were killed),"You are supporting a diet rich in fiber, antinutrients and carbs. This is really bad.",vegan,Villageidiotcity,1577755202,7,True,2019-12-30
41,STOP PROMOTING VEGANISM VEGANISM = MALNUTRITION,"You are supporting a diet rich in fiber, antinutrients and carbs. This is really bad.

——

If you want to downvote me, please kindly tell me what I said that was wrong so I can learn instead of just putting down what I say without feedback.",vegan,Villageidiotcity,1577755831,28,True,2019-12-30
45,Is there another sub that's just for vegan food?,"I just can't stand all the posts about the animals anymore, I love animals, I just can't see that anymore. I feel like those things should all be posted to a sub like animal rights or something. I want to learn about being vegan. This is just not what I'm looking for in a sub and I am going to have to say goodbye.",vegan,FlashFox24,1577757746,4,True,2019-12-30
46,Waking Up: Life on a Small 'Humane' Farm,"*You cannot carry passengers on a smallholding. This is what I had been told. I didn't like it but I believed it to be true. Everything has to earn its keep.* 

*Be strong.* 

*Onion had his head chopped off... we ate him*

&amp;#x200B;

Vicky Hamill's childhood love of animals inspired her move to a smallholding in the wilds of Orkney. Initially she had some chickens and a goat but, unable to refuse any animal that needed her help, she quickly found herself tending a motley collection of sheep, cows, goats and geese on her small 'humane' farm.

But farm animals have a defined life cycle. In this memoir, Vicky recounts the conflict between her attachment to her animals and the demands of farming. She vividly recalls the joys of feeding newborn lambs and the despair of killing them, joyous and heartbreaking moments that eventually led her to quit the farm and become a vegan.

Exquisitely narrated and deeply moving, this is a book for anyone who questions the morality of the food on their plate. It doesn't preach but it convincingly tells the story of one woman's journey towards awareness.

&amp;#x200B;

[https://www.amazon.com/Waking-Up-Life-Small-Humane/dp/1913071421/ref=sr\_1\_1?keywords=waking+up+life+on+a+small+humane+farm&amp;qid=1577757599&amp;sr=8-1](https://www.amazon.com/Waking-Up-Life-Small-Humane/dp/1913071421/ref=sr_1_1?keywords=waking+up+life+on+a+small+humane+farm&amp;qid=1577757599&amp;sr=8-1)",vegan,veganarchoprimitivis,1577757768,0,True,2019-12-30
47,Knee pain,I went vegan for a few weeks and started experiencing knee pain. It went away after eating meat again. My vitamin D dropped below optimal levels as well. Anyone else experience this or am I just crazy?,vegan,dreamius,1577758051,9,True,2019-12-30
48,Typical shopping list?,"I’m sure this question has been asked before. If there is a good thread or reference to follow please let me know. 

I’ve incorporated vegan meals into my usual schedule but it has tended to be only the few same ones. 
I went grocery shopping today with a goal of putting together a 100% vegan grocery cart, but found I ended up spending about 50% more and am not really sure I got things that turn into “meals”. 
I think this might have been because I was too worried about protein, and was looking for substitutions. 

Would anybody share what their typical shopping list looks like for a week along with budget? I would be especially interested for those that are fairly lazy cooks with minimal kitchen space. I don’t need every meal to be a gourmet wonder",vegan,kmac17,1577758674,8,True,2019-12-30
49,I need to vent about Pieology in Stamford Connecticut,"So, it being the  holiday season I decided I needed some vegan Pizza.  Boyfriend and I drove 20 miles to my favorite pizza joint Pieology.  I had been there twice before and made a special trip as they let you build your pizza with vegan cheese options and vegan meat.  I started by choosing my crust and I was told by the server that their regular crust which I had eaten twice before contains cheese and eggs. Like in the dough!! I was told the only vegan crust was the gluten free option. Like WTF? You are offering vegan options but no regular crust ?  Pielogy is no longer my favorite pizza place😔",vegan,campbell99,1577758921,8,True,2019-12-30
50,Excessive Sweating Help,"I recently started to eliminate animal products from my diet. Besides the ethical purpose of the diet change, I am also hoping that going vegan will help some health problems I have. One of these problems is the excessive sweating that I have.

The condition is technically called hyperhidrosis and I only have it on my hands. I'm sure anxiety has something to do with its occurence, but it usually happens uncontrollably at certain periods of the day. Its very frustrating.

Does anyone know if a vegan diet would help with this problem?",vegan,jlatran0618,1577759209,5,True,2019-12-30
54,Microbiome still adjusting?,"I’ve been eating vegan (trying for mostly whole food plant based) for about 6 weeks now. I do eat processed vegan junk food sometimes but I’m trying to decrease that because I know it’s not great. About 60% of the time I notice I’m very bloated in the afternoon/evenings. It’s not painful, but it is odd. I get annoyed thinking I’m gaining weight, but then in the morning (been having the best BMs of my life) my stomach is pretty flat. Is this my body still adjusting to eating more plants? If so, how long until this gets better? I’m over here like damn, I’m slimming down! And then by 5pm I’m like fuck I’m fat haha 🤦🏼‍♀️",vegan,s_beiermann,1577760702,8,True,2019-12-30
57,vegan alfredo sauce,please god will someone reply with an vegan alfredo sauce that taste like olive garden alfredo sauce please,vegan,mxkaeii,1577761943,7,True,2019-12-30
58,What is a vegan way to deal woth mosquitoes,"I live in a hot country (Brazil) and some places are basically mosquitoes everywhere and they are very annoying, but i basically lived and adapted with some stuff like resisting itching in bites in general

Ever since i've gone vegan one of those approach me and i dont want to kill it, i just dont i refuse

But it could fall in the category of self defense right? theres a risk of me catching a nasty disease  being more bitten

 although i dont know how much killing one or two changes how much they bite me considering i wake up with a number close to 10 bites every time i sleep without a fan or high altitude like a building, even with blankets covering everything (These malevolous flying black dots are magical too apparently)

I could determine the risk of catching a disease, i dont know exactly but based on what i said i think i got bitten by mosquitoes in somehing like a 3 digit number of times

So am i very lucky too? lol",vegan,LuisBurrice,1577762245,7,True,2019-12-30
59,Anyone want to school a dumbass?,"Check the r/AskReddit post about things people think are healthy, but really aren’t. Some idiot claims it’s necessary to eat meat daily in order to be healthy and that it is prohibitively expensive to obtain enough protein otherwise.",vegan,vitamincoverdose,1577762673,2,True,2019-12-30
60,Mom thinks being vegan is partly why I’m depressed,"I’ve had gut issues for YEARS before I was vegan. I recently moved closer to my family and started working on improving my gut health and diet/lifestyle. I’m in a low in my life, being unemployed, starting over, etc. I’m very depressed and I’m taking steps to be more open to family about it. But my mom keeps giving me shit about my diet and at times I can’t defend myself because my depression really warps my perspective on things. Ughhh",vegan,cratersarecool,1577763168,9,True,2019-12-30
61,What are your thoughts on honey?,"I already know that by the strictest definition honey is not vegan. But, what are some benefits of honey as a sustainably produced product? What are ways that I can find the most sustainable honey possible? The most humane? Price isn't really a problem, if I thought I could find a way to get honey that was ethically sound I would spend a pretty penny.",vegan,oldmangandalfstyle,1577763314,6,True,2019-12-30
63,What do vegans think of a cat's diet?,"If it's dangerous to give cats a plant based diet, do vegans feel upset sacrificing their love for other animals for the cat to survive or do they oppose cats all together?",vegan,FriendlyZombie195,1577764132,12,True,2019-12-30
66,"Recipe ideas for party snacks, ~200 guests?","I love to bake, but I'm not sure what to put together for this many people. Playing with ideas like mini cookies, mini muffins, or a tiered layer cake. It's for a birthday party. What would a vegan do?",vegan,infundibulum000,1577764547,1,True,2019-12-30
67,tofu?,"hi there, recently went vegan after 9 years of vegetarianism. Since transitioning to veganism I’m trying really hard to eat a lot healthier. As a vegetarian, I ate a lottt of Quorn products. I’ve only ever tried tofu once at a restaurant and hated the texture. A lot of recipe books I have call for using tofu/seitan/tempeh. I’m looking for an idiots guide to understanding where to begin when cooking with tofu, seitan or tempeh and what the texture or taste of each of them is like. I really like the texture and taste of quorn vegan pieces but I’m trying to branch away from supermarket bought meat substitutes. any advice is welcome !!!! thank you",vegan,nxaxixd,1577765458,3,True,2019-12-30
70,Are onion bhajis vegan?,Going out for a curry on NYE.,vegan,aldo16,1577766240,6,True,2019-12-30
74,I'm ready to take the plunge... I'm going vegan in 2020!!!,I'm already vegetarian but I've decided that I'm sick of not fully honoring my belief in kindness towards animals by consuming eggs and dairy. I'm tired of feeling like a hypocrite.,vegan,bad_thrower,1577767978,69,True,2019-12-30
