,title,selftext,subreddit,author,created_utc,num_comments,is_self,timestamp
70,What is a good price for tofu?,"Hi, I'm just wondering how much tofu should be? I'm shopping around online and the cheapest I can find from a supermarket is £2 for 396g of Cauldron organic blocks. Is this cheap or expensive for tofu? I only ask as I need to get more protein and cut down on beans a bit as I think they're bloating me. Thanks.",vegan,lsmith97,1575203992,6,True,2019-12-01
72,THE ULTIMATE TRUTH,"As the title indicates, I'm trying to find out the ultimate truth about which diet is best, but there are always some source I trust that contradicts other sources and I'm back where I started.

I want to believe that facts presented in movies, such as ""The Game Changers"" and ""What The Health"", are true. Yet on YouTube a source I trust Dr.Berg still suggests keto, or just specific products, for instance, eggs. And when I reply to my friends' Instagram story where he is eating salami pizza with a response ""Watch ""What The Health"" you might rethink your pizza life"". I get a response ""I'm immune to that vegetable propaganda"". 

There is so much information out there, I just don't know what to believe anymore. Sure, plant-based diet won't hurt you, but are these movies I've mentioned truly objective, or are they forcing you to believe that nothing that comes from animals will ever help you?

I know I'm posting this on Vegan, and responses might be biased. I'm just looking for some answers (The Ultimate Truth as I call it) so I can devote myself to diet I end up with figuring out. (Right now I'm a vegetarian, who does vegan-days, and some vegan meals in-between.

Also while we are at it... People, who call themselves Vegans - it's a lifestyle, right? Not a diet? Then you couldn't own leather shoes, jackets, etc. And those who call themselves vegans, but only eat plant-based are not in particular actual vegans? 

Thank you for reading the post, I will appreciate all the comments (as I'm looking through every possibility).

Have a nice day! :)",vegan,OneTr1ckX,1575204657,33,True,2019-12-01
73,Vegan pizza options for toppings. Which ones are your favorite?,I'm stick with mushrooms and spinach,vegan,blue_bunny21,1575204926,13,True,2019-12-01
74,Looking for some books on the ethical part of veganism,"I know a plant based diet is the healthiest,but i'm interested in the ethical side as well.

Any recomandations ?",vegan,eusuntjur,1575205109,6,True,2019-12-01
79,"Despite such a progressive title the book, Soul of an Octopus by Sy Montgomery, doesn't encourage anybody to stop abusing and consuming animals.","I just finished Soul of an Octopus and while it was informative I was not impressed. Early in the book the author talks about eating sushi with her friends from the aqaurium and proudly announces they didnt order the octopus, but they have no issue eating other fish? That is where I fist became skeptical of the book.

Throughout the book she talks about how animals like Eels, sharks, lobsters, etc. feel pain, can sympathize, and have different moods, but she never condemns eating them, and later she quite blatantly defends aquariums' ""need"" to capture these animals in the wild and pull them out of thier natural environment and homes to show off to the public.  She even talks about getting a pet octopus, but only refrains because it would be hard on her husband. (Capturing thriving wild animals for your own amusement should be considered non-vegan right?) 

The books includes other things like forced mating of octopuses, death of captive animals caused by lack of planning but labeled ""unavoidable"", and the people in the book treated animals like paintings in a shitty muesuem to be traded and transported around in small containers (The book unapologetically describes an octopus being mailed in bag of water filled with its own excrament stuffed into an old tv box labeled ""RUSH"", but not labeled delicate or live animal). Anyways I just wanted to rant to people who might feel the same way.",vegan,MurdocMcMurphy,1575210387,4,True,2019-12-01
80,Vegan Christmas gift?,"Hello! I am trying to find a Christmas gift for my  friend who is vegetarian (though mostly vegan &amp; trying to eventually become 100% vegan). I have a few ideas in mind, but was wondering if there are any well known vegan treats or products she might enjoy. If any of you have suggestions, I’d love to hear them :-) thanks!",vegan,redeyeball12,1575210959,6,True,2019-12-01
81,Saw some vegan brownie mix at the store last night,"The little certified vegan logo caught my eye, thought I better check the directions just in case. ""You will need: two eggs"" 😒",vegan,Justanotheru99,1575210989,2,True,2019-12-01
82,Convince me.,"I know, the title appears a bit presumptuous. It gives the impression that I just want to argue. I've had plenty of arguments with vegans. I'm not looking for that here. If I wanted to argue, I'd go jump in one of your threads that are already started. I'm really looking for some opposing insight. Now before we get started, let's name the parts that would be a waste of your time trying to convince me. Number 1 by far is empathy/sympathy. I grew up with pets my entire life and at times I respect animals more than humans. But it's a complication between intent and instincts. Humans know what they are doing, animals do not. So animals are more innocent. But I can't grant rights to life to a creature that does not even comprehend the concept of life or death. If you can't comprehend what death is, then you care not for it. Number 2 is the environment. Yes, livestock creates a shitload of farts that fuck up the ozone. But so does your cars, factories, your kids that end up in a job with their name on their shirt breathing our air. Livestock isn't the biggest factor. So do something about the bigger ones before you get up in my diet. I don't want to hear that shit until livestock becomes the top problem. Well, actually that's the only two points I can remember right now that hold any significance at all. I had a list of 5 things in my head but the alcohol kicked in faster than expected. What I do remember is a pleasant vegan I spoke with on youtube who was willing to talk without arguing. We almost came to an agreement, but then they stopped answering. Youtube's fault. Their notification thing is shit. I have to track down old threads sometimes to answer people because even though they tagged my name, youtube didn't notify me that someone responded to me. So, I figure he just didn't get the notification that I responded. But where we ended up is I am willing to give up meat if certain criteria is met. The vegan meat must taste like the real thing. And all B12 and other supplements must be included into food without me having to read labels or keep track of doses. Basically, it needs to be just as convenient and tasty as real meat is. I'm even planning on going to Burger King to try their new veggie burger that they claim tastes like a regular burger. Was supposed to last week, but just my fucking luck that my car busted a hose right before getting there. I pulled into a parking spot and immediately saw steam coming up from my hood. I even said fuck it and went to go inside and figured I might as well eat since I'm there and deal with the car after since it was obviously just a hose and I lived only a couple blocks away. But just my damn luck again, they had a sign on the door that the inside was closed due to being understaffed and only the drive through was open. Well fucking thanks BK. The one thing I just became unable to do and it's the only way I can get that burger. God, you're an asshole sometimes. I was even tempted to push my car into the drive through just cause I'm very fucking determined once I set my mind on something. I wanted that damn burger and I still want to try it now. But all that aside, even if they did succeed at making a veggie burger taste like a real one, they'd be the only one. And it's still fast food. I can't live off BK veggie burgers. And yes, I am so addicted to meat that I'm not giving it up without something to take it's place that tastes just like it. And it would have to have the B12 added. I'm so not doing the pill counting bullshit. I am not, absolutely not, going to take B12 pills when I can just eat tasty meat that already has it. So, do any of you vegans have an answer for all that?",vegan,88ThatsWhatSheSaid88,1575212139,12,True,2019-12-01
85,Just getting started,"Hey everyone,
So, I just went vegan almost three weeks ago and while it's early days, I do feel the benefits, not so much in my waistline but in my conscience. 🙂 However, I've never had spectacular culinary skills to say the least, so I was just wondering if any of you had simple vegan recipes or delicious plant alternatives that I could or should try. I appreciate any help. 🙂",vegan,Ellen_Ichiban81,1575213013,6,True,2019-12-01
86,What’s your favorite vegan chili recipe?,"Winter has hit hard in MN this weekend, and I’m new to being vegan (1.5 years or so) looking to make some chili this week. 

What are your best recipes?",vegan,iGoalie,1575213126,3,True,2019-12-01
88,Noticed a drop in my white blood cell count after becoming vegan,"I've been vegan for over 3 years now, and my overall health has improved significantly. (Lost 40 lbs, decreased cholesterol levels, lower blood pressure!)

One thing I've noticed is that my white blood cell count had steadily decreased since becoming vegan, and has fallen out of the normal range. Has anyone else noticed a similar change? I'm also scheduling an appointment with my doctor, but they list being vegan as a ""medical condition"" on my chart.",vegan,Rdioheaded,1575213860,4,True,2019-12-01
91,"Stop saying ""chicken periods"" like that's gross","It always bothers me to hear this argument, like periods are intrinsically and magically awful and wrong- so what? 

I understand avoiding eggs because to get them, chickens have to be TORTURED AND MURDERED and all- torture and murder are horrible and magically awful and wrong, but, periods?  So what?",vegan,PapaPinyun,1575214804,31,True,2019-12-01
92,What are the optimal vegan meals - for nutrition and preparation efficiency?,"Most of the common recipes you find online are designed by people with a love for baking and the time to prepare and write about food. What recipes would you recommend for someone that has no interest in heating food a certain way in order to add texture, layering ingredients to make their meals look pretty or mixing a large number of herbs &amp; spices for taste?  


I am curious to know what an optimal meal plan (in terms of nutrition and preparation efficiency) should look like for someone that does not want to lose or gain weight.  


Any suggestions?",vegan,a-curious-wanderer,1575215350,2,True,2019-12-01
95,Convince me.," I know, the title appears a bit presumptuous. It gives the impression that I just want to argue. I've had plenty of arguments with vegans. I'm not looking for that here. If I wanted to argue, I'd go jump in one of your threads that are already started. I'm really looking for some opposing insight. Now before we get started, let's name the parts that would be a waste of your time trying to convince me. Number 1 by far is empathy/sympathy. I grew up with pets my entire life and at times I respect animals more than humans. But it's a complication between intent and instincts. Humans know what they are doing, animals do not. So animals are more innocent. But I can't grant rights to life to a creature that does not even comprehend the concept of life or death. If you can't comprehend what death is, then you care not for it. Number 2 is the environment. Yes, livestock creates a shitload of farts that fuck up the ozone. But so does your cars, factories, your kids that end up in a job with their name on their shirt breathing our air. Livestock isn't the biggest factor. So do something about the bigger ones before you get up in my diet. I don't want to hear that shit until livestock becomes the top problem. Well, actually that's the only two points I can remember right now that hold any significance at all. I had a list of 5 things in my head but the alcohol kicked in faster than expected. What I do remember is a pleasant vegan I spoke with on youtube who was willing to talk without arguing. We almost came to an agreement, but then they stopped answering. Youtube's fault. Their notification thing is shit. I have to track down old threads sometimes to answer people because even though they tagged my name, youtube didn't notify me that someone responded to me. So, I figure he just didn't get the notification that I responded. But where we ended up is I am willing to give up meat if certain criteria is met. The vegan meat must taste like the real thing. And all B12 and other supplements must be included into food without me having to read labels or keep track of doses. Basically, it needs to be just as convenient and tasty as real meat is. I'm even planning on going to Burger King to try their new veggie burger that they claim tastes like a regular burger. Was supposed to last week, but just my fucking luck that my car busted a hose right before getting there. I pulled into a parking spot and immediately saw steam coming up from my hood. I even said fuck it and went to go inside and figured I might as well eat since I'm there and deal with the car after since it was obviously just a hose and I lived only a couple blocks away. But just my damn luck again, they had a sign on the door that the inside was closed due to being understaffed and only the drive through was open. Well fucking thanks BK. The one thing I just became unable to do and it's the only way I can get that burger. God, you're an asshole sometimes. I was even tempted to push my car into the drive through just cause I'm very fucking determined once I set my mind on something. I wanted that damn burger and I still want to try it now. But all that aside, even if they did succeed at making a veggie burger taste like a real one, they'd be the only one. And it's still fast food. I can't live off BK veggie burgers. And yes, I am so addicted to meat that I'm not giving it up without something to take it's place that tastes just like it. And it would have to have the B12 added. I'm so not doing the pill counting thing.",vegan,88ThatsWhatSheSaid88,1575215960,0,True,2019-12-01
96,Diet advice for kidney stones,"About 5 years ago I was moving towards a vegan diet.  Then I got hit by bilateral kidney stones where they were too large to pass.  Turns out they were calcium oxalate stones.  These stones have repeated every 12-18 months, although a few have passed.  I have a killer one right now with blinding pain.  

Much of my diet at that time of the original stones were nuts, berries, leafy greens, and vegetables.  My drinks were soy based and teas.  

So I moved back away from many of these things I liked.

Has anyone here dealt with calcium-oxalate stones and found a good balanced diet?",vegan,wot-mothmoth,1575215993,9,True,2019-12-01
102,I need your help to find a book,"My boyfriend and I are both vegan. We're not the people that talk about it much around family but his mother apparently cannot stop talking about it. She is absolutely convinced that a vegan diet is the worst thing we could have done to her (idk it's not like we live with them and she needs to cook for us) and keeps telling my boyfriend how unhealthy a vegan diet is. We tried telling her that we did our research on all the vitamins and minerals a human needs and how to eat those. We even told her that most football players, especially Messi and Ronaldo, are vegan to enhance performance but she just brushed it off saying how she can't imagine it being healthy.
Now I would like to give her a book for Christmas that explains the positive sides of a vegan diet but I don't know which one to get.
Her and her husband eat meat in every single meal and both have high cholesterol but they think their diet is healthy. I need to find a book that will help her understand how animal products are shit - especially if you have problems from eating to many of them- and a vegan diet won't kill her son.",vegan,JasminIsTaken,1575216848,4,True,2019-12-01
105,Convince me.,"Before I start, the moderators are proving that the vegan community is an echo chamber. I gave a way for vegans to get me on their side in my last post. But the moderators shut down the post and basically said I was in violation for having a different point of view. They worded it something along the lines of ""no debating"". Wow ok, it's either be vegan or you're not allowed to speak here. Well fuck that and to hell with stubbornly ignorant people like that.

Anyway, I'm willing to be vegan if anyone can come up a meat substitute that actually tastes like the real thing and has all the stuff like B12 in it so I don't have to buy pills or supplements. And they must have a practical way that the world can become vegan. Can't just shut down the industry because that would cause more harm than good. So, does anyone actually have a way the implement world wide veganism without causing more problems or fights?",vegan,88ThatsWhatSheSaid88,1575217743,36,True,2019-12-01
106,"Can I go Paleo and Keto and low Fodmap, and still remain vegan?","Seriously, what's left? What would I survive on? 
Have any of you done it?",vegan,kappakingtut2,1575217931,9,True,2019-12-01
107,Knee jerk anti vegan reactions in other subreddits. Should we call them on it? Is anything effective?,[removed],vegan,wot-mothmoth,1575218055,0,True,2019-12-01
109,Best air fryer for tofu?,I've seen a few posts saying how great they are for cooking tofu and I'm definitely interested. Can anyone recommend a good one for tofu? Or just general things to look out for. Thanks!,vegan,cbizz23,1575218282,3,True,2019-12-01
114,My take on NOMO chocolate bars.,,vegan,Royaourt,1575220441,2,True,2019-12-01
115,i hope your moms are be die,,vegan,irishmapping,1575220704,0,True,2019-12-01
116,Ethically obtaining a pet fish,"Hi there fellow vegans. Title says it all. I want a betta fish, and I have the means to properly care for one, 10-20 gallon tank with heater and filter, etc. I know we shouldn’t purchase one from pet smart/petco because of the breeding and everything, so how does one properly get a pet fish? I’ve looked on Craigslist near me to see if anyone’s looking to get rid of one and no dice.",vegan,love_please,1575220812,10,True,2019-12-01
118,UK Vegans!,"Check out this guide to vegan Christmas food currently available in UK supermarkets! What will you be having for Christmas this year! 

[https://clairecross.co.uk/2019/12/01/ultimate-guide-to-uk-vegan-christmas-food-2019/](https://clairecross.co.uk/2019/12/01/ultimate-guide-to-uk-vegan-christmas-food-2019/)",vegan,crairecloss,1575221483,0,True,2019-12-01
123,Help! Amino Acids? Where can I find them? Do I need them? Where was I getting them?,"Approx 4 weeks being a vegan before that I was a pescatarian eating Fish no more than once a week. 

My friend who’s also recently become a vegan from a pescatarian but he was eating fish at least once a day has asked me where am I getting my amino acids from. 

My friend gets his from the clean lean protein shake, I don’t take protein shakes at the moment but I’m looking to buy some this week.",vegan,Turn1to10,1575223807,7,True,2019-12-01
126,I'm loving the semi-vegan lifestyle!,"I've decided to take a hold of my diet, and support good conditions for animals, and take a stand.

Since adopting this style of veganism, I've cut down strongly on meat. Yesterday, I made a sprouted avocado sandwich, and it was so yummy! I used a little prosciutto, and I recommend it to anyone switching from full to semi-vegan.

Yes, on Thanksgiving I mostly filled up on Turkey, but I made sure to balance it with an avocado. I'm very happy to be helping the world, and spreading the vegan cause. I even recommended it to my family when we met for thanksgiving!

I'm really happy with this diet choice, there really is no other way now.",vegan,HighThe,1575224045,6,True,2019-12-01
128,"""It's just a little bit""","I really hate when I say I won't eat something because there are animal products in it and people say ""well there's just a little in there"".  

Like yesterday my parents had people over and someone made a dessert and my mom and I both said no thank you since we're vegan and the person who made it told us she didn't use that much butter so we should just eat it anyway. Like, we aren't on a diet we just don't want to eat something that came out of a cow.",vegan,gabby_papabless,1575224365,6,True,2019-12-01
129,Any famous ancient people who were vegan? I only know Plutarch,,vegan,gamaliel159,1575224419,10,True,2019-12-01
130,"Question about Vegan “imitation foods” like Vegan cheese, meat, milk, etc","Hey all! 

I’m a newbie to Veganism - currently transitioning from an omni diet. I’ve probably got the same story as a lot of people as far as the transition goes - shame about my willful ignorance regarding factory farming, guilt about my environmental footprint as an omni, etc. 

Anyways, I’m happy to be making the transition now! I have a question that’s been weighing on me, though, and I’m hoping to ask it without coming across as offensive or ignorant, as that’s not my intent at all. Please forgive me for any mis-steps here! 

I’m curious about the environmental footprint of the Vegan “imitation” foods on the market that are created to mimic dairy and meat. I must admit that I’m loving the beyond burgers, but they’re super over-packaged and I find that quite disappointing. That’s caused me to also consider all of the production and processing that goes into creating these imitation products, as well. The products themselves can be really good - but with all of the packaging and processing, what is their environmental impact? 

I’ve seen a lot of conversation on the topic of the environmental cost of the meat and dairy industries, but does anyone know how the Vegan imitation food industry compares? 

Again, I mean no offence, so I’m very sorry if this comes across as offensive. I’m just curious about how I can move forward with my Vegan diet in a conscious and informed way - and with these industries growing so quickly, I do find some cause for concern. 

Thank you so much to everyone who took the time to read this, and to those who take the time to respond!",vegan,RootedInLife,1575224432,11,True,2019-12-01
139,You vegans can't ride gasoline or diesel cars,"Since fossil fuel is partly made out of dinosaurs and other dead animals, you can't use gasoline or diesel to ride your cars.",vegan,SolvingBrush7,1575226356,12,True,2019-12-01
140,Vegan world building activity,I got a pretty cool opportunity to participate in a world building activity. We imagined what the world would look like if we ended factory farming in the 60s when scientists first started noticing issues. My piece was the music of this world and i would like to share it with you all. [here](https://youtu.be/OFtGbDT-YRM),vegan,alottachairs2,1575226392,0,True,2019-12-01
143,Did going vegan help any of your skin issues?,"I have recently gone vegan after being diagnosed with facial seborrheic dermatitis a few months ago. There is redness between my eyebrows which sometimes gets slightly better and sometimes gets redder. I had already been vegetarian for years due to ethics and always wanted to be a vegan. After having experienced this issue, I started to search more to find out the relationship between the two. It seems that the result is different for everyone. I have always been prone to allergy-induced issues. So my diet is gluten-free too. I am also trying to avoid foods containing yeast. When I have the time, I want to take a test to learn the things I am allergetic to but for now I am just testing. All in all, I just want to know if there are people like me who has sebderm and whose dietary change has helped them.",vegan,wiki_lee,1575227306,34,True,2019-12-01
145,Need help with a Tiramisu recipe,"I traditionally make Tiramisu for my family on Christmas Eve. I've been fully vegan for a couple of months now, but my mom asked me today if I would make a ""real"" Tiramisu again this year.

I really don't want to make anything with dairy in it, so I'm asking if anyone here knows a vegan recipe that comes very close to real Tiramisu taste wise? 

Or generally, I'd be very grateful for ""omni-approved"" vegan dessert recipes that I could make for my picky family instead.

Thanks in advance for any advice!",vegan,r0ciobelle,1575227897,1,True,2019-12-01
146,My go-to for protein are eggs. What's a good switch?,"First time posting here, sorry in advance for my ignorance.

I've been considering going vegan because it seems like the best way to combat climate change on an individual level(besides voting). The main issue would be giving up eggs.

I honestly love eggs and I'll eat them in every way possible. Stick them in a sandwhich, tortilla, salad, rice, or by itself with some salt. Is there anything quite as versatile I can use to switch it out?",vegan,Caleebies,1575227900,17,True,2019-12-01
149,"""It is already dead. So why not eat it?""","When Christmas is coming I will sit together with my extended family and they are all carnivors. I however am taking the last steps to become 100% vegan and don't want to touch any animal-products on christmas-dinner.
But I am convinced that I will hear the argument presented in the title. What would you respond to that? Should I eat meat or not?",vegan,Itz_Th0mas,1575228966,19,True,2019-12-01
